[u'will', u'let', u'enemies', u'take', u'advantage', u'us', u'like', u'obama', u'hillary', u'will', u'!', u'new', u'american', u'century'],Hillary Clinton,AGAINST
[u'hillary', u'will', u'get', u'past', u'primaries', u'cause', u'dem', u'voters', u'think', u'can', u'wrong', u'will', u'beat', u'november'],Hillary Clinton,AGAINST
[u'voting', u'hillary'],Hillary Clinton,AGAINST
[u'hillary', u'debate', u'question', u'profess', u'admiration', u'margaret', u'sanger', u'wanted', u'rid', u'country', u'negros', u'explain', u'please', u'?'],Hillary Clinton,AGAINST
[u'hillary', u'transparent', u'brick', u'wall', u'liberty', u'not', u'hillary'],Hillary Clinton,AGAINST
[u'even', u'manage', u'wants', u'wake', u'up', u'america', u'stop', u'hillary'],Hillary Clinton,AGAINST
[u'really', u'excited', u'finding', u'amount', u'raised', u'got'],Hillary Clinton,AGAINST
[u'troll', u'!'],Hillary Clinton,NONE
[u'thanks', u'follow', u'may', u'god', u'bless', u'family', u'!'],Hillary Clinton,AGAINST
[u'thank', u'adding', u'list'],Hillary Clinton,NONE
[u'chris', u'christie', u'president', u'?', u'hahahahaha', u'!', u'think', u'!', u'clinton', u'hilary'],Hillary Clinton,AGAINST
[u'hillary', u'must', u'navy', u'yard', u'sniper', u'fire', u'!'],Hillary Clinton,AGAINST
[u'hillary', u'use', u'fucking', u'fax', u'machine', u'idiots', u'going', u'vote', u'president', u'?'],Hillary Clinton,AGAINST
[u'>', u'continued', u"obama's", u'admin', u'policymaking', u'u', u'will', u'become', u'greece', u'!', u'wake', u'up', u'america', u'n', u'j'],Hillary Clinton,AGAINST
[u'just', u'full', u'tonight', u'hilary', u'duff', u'quotes', u'of', u'the', u'day'],Hillary Clinton,NONE
[u'hey', u'transparent', u'...', u'santa', u'?', u'lib', u'hack', u'pay2', u'play', u'corruptocrat', u'benghazi', u'vince', u'foster', u'monica'],Hillary Clinton,AGAINST
[u'even', u'elections', u'yet'],Hillary Clinton,NONE
[u'can', u'half', u'favor'],Hillary Clinton,FAVOR
[u'love', u'bern', u'time', u'!'],Hillary Clinton,AGAINST
[u'innovation', u'development', u'make', u'utopia'],Hillary Clinton,FAVOR
[u'great', u'convo', u'last', u'night', u'w', u'great', u'connections', u'waverly', u'fellows', u'commit', u'to', u'caucus'],Hillary Clinton,NONE
[u'bad', u'punning', u'gets', u'worse', u'better', u'time', u'remember', u'america'],Hillary Clinton,NONE
[u'crook', u'...', u'like', u'like', u'yes', u'hillary', u'campaign', u'slogan', u'wake', u'up', u'america', u'stop', u'hillary'],Hillary Clinton,AGAINST
[u'got', u'black', u'lives', u'matter', u'vote', u'w', u'o', u'even', u'talking', u'blacks', u'brainwashed'],Hillary Clinton,AGAINST
[u'genitalian'],Hillary Clinton,NONE
[u'thoughts', u'ruling', u'keep', u'archaic', u'non-science', u'based', u'beliefs', u'laws', u'secular', u'nation'],Hillary Clinton,NONE
[u'confident', u'will', u'piss', u'white', u'anglo-saxon', u'protestants', u'!', u'keep', u'talking', u'jeb'],Hillary Clinton,NONE
[u'will', u'pick', u'vp', u'mark', u'tweet', u'unstoppable', u'ticket', u'elizabeth', u'warren'],Hillary Clinton,FAVOR
[u'moving', u'forward', u'next', u'focus', u'making', u'higher', u'education', u'attainable', u'eliminating', u'gender', u'pay', u'gap'],Hillary Clinton,NONE
[u'open', u'mouth', u'reveal', u'heart-margaret', u'sanger', u'architect', u'black', u'genocide', u'hillary', u'so', u'white'],Hillary Clinton,AGAINST
[u'someday', u'want', u'see', u'well', u'qualified', u'candidate', u'president', u'united', u'states', u'?', u'reflecting', u'hillary'],Hillary Clinton,FAVOR
[u'emails', u'?', u'released', u'rest', u'boring'],Hillary Clinton,AGAINST
[u'cruz', u'perry', u'win-win', u'choice'],Hillary Clinton,AGAINST
[u'donald', u'trump', u'joke', u'simpleminded', u'idiot', u'nothing', u'else', u'say', u'can', u'go', u'fuck', u'self'],Hillary Clinton,NONE
[u'haha', u'love', u'header', u'!'],Hillary Clinton,NONE
[u'likely', u'felon', u'many', u'times', u'protected', u'political', u'class'],Hillary Clinton,AGAINST
[u'broke', u'dead', u'broke', u'elitist', u'nauseating', u'get', u'behind', u'rope', u'hateful', u'arrogant', u'z', u'ideologue', u'someone', u'else', u'add', u'z'],Hillary Clinton,AGAINST
[u'use', u'brain', u'keep', u'hillary', u'white', u'house.clinton'],Hillary Clinton,AGAINST
[u'shocked', u'burst', u'flames', u'!', u'wake', u'up', u'america', u'america', u'great', u'again'],Hillary Clinton,AGAINST
[u'whose', u'opportunist', u'now', u'no', u'hillary'],Hillary Clinton,AGAINST
[u'emails', u'missing', u'incomplete', u'?', u"who'd", u'thunk', u'?', u'law', u'rest', u'peons', u'!', u'just', u'trust', u'!'],Hillary Clinton,AGAINST
[u'can', u'run', u"ca't", u'hide', u'clinton', u'foundationscandal', u'clinton', u'cash'],Hillary Clinton,AGAINST
[u'feel', u'confident', u'will', u'win'],Hillary Clinton,AGAINST
[u'gop', u'needs', u'handling', u'campaign', u'attacking', u'showing', u'hillary', u'fails'],Hillary Clinton,AGAINST
[u'probably', u'perfect', u'everyone--which', u'think', u'great', u'beginning', u'conversation'],Hillary Clinton,NONE
[u'hillary', u'want', u'put', u'anyone', u'prison', u'anymore', u'obviously', u'worried', u'future'],Hillary Clinton,AGAINST
[u'gee', u'busy', u'schedule'],Hillary Clinton,AGAINST
[u"today's", u'number', u'8', u'!', u'many', u'years', u'old', u'jesus', u'learned', u'ride', u'bike', u'!', u'pretty', u'cool', u'dude', u'!', u'u', u'w', u'n', u't'],Hillary Clinton,AGAINST
[u'want', u'appointed', u'ambassador', u'post'],Hillary Clinton,NONE
[u'really', u'tough', u'time', u'seeing', u'leaders', u'running', u'potus', u'quess', u'will', u'wait', u'see', u'happens'],Hillary Clinton,NONE
[u'thanks', u'follow', u'david', u'may', u'god', u'bless', u'family'],Hillary Clinton,NONE
[u'many', u'women', u'many', u'countries', u'speak', u'language', u'silence', u'hillary', u'clinton', u'hillary', u'cliton', u'hillary4', u'women'],Hillary Clinton,FAVOR
[u'man', u'demanded', u'staff', u'get', u'ice', u'tea', u'called', u'sexists', u'elitist', u'pig', u'..', u'oink', u'oink', u'hillary'],Hillary Clinton,AGAINST
[u'america', u'needs', u'champion', u'!', u'h', u'thanks', u'need', u'champion', u'especially', u'champion'],Hillary Clinton,AGAINST
[u'way', u'support', u'hillary', u'elizabeth', u'warren', u'ran', u'karl', u'marx', u'running', u'clinton'],Hillary Clinton,AGAINST
[u'thanks', u'much', u'article', u'!'],Hillary Clinton,NONE
[u'hillary', u'claims', u'champion', u'middle', u'class', u'tax', u'plan', u'cuts', u'fica', u'tax', u'benefiting', u'middle', u'class'],Hillary Clinton,AGAINST
[u'think', u'hillary', u'taking', u'foreign', u'money', u'muslim', u'brotherhood', u'probably', u'favor', u'obama', u'chief', u'justice'],Hillary Clinton,AGAINST
[u'thank', u'much', u'rts', u'favs', u'eloisa', u'thomas', u'!', u'!', u'!', u'wake', u'up', u'america'],Hillary Clinton,NONE
[u'hillary', u'prez', u'=', u"obama's", u'third', u'term', u'last', u'thing', u'need', u'!', u'!'],Hillary Clinton,AGAINST
[u'even', u'manage', u'wants', u'wake', u'up', u'america', u'stop', u'hillary'],Hillary Clinton,AGAINST
[u'yes', u'!', u'chipping', u'5', u'$', u'faith'],Hillary Clinton,FAVOR
[u'first', u'time', u'rodeo', u'!', u'care', u'likes', u'woman', u'mission', u'tough'],Hillary Clinton,FAVOR
[u'bad', u'wife', u'bad', u'role', u'model', u'women', u'bad', u'lawyer', u'bad', u'first', u'lady', u'bad', u'senator', u'horrible', u'secretary', u'state'],Hillary Clinton,AGAINST
[u'last', u'week', u'=', u'life', u'obamacare', u'gay', u'marriage', u'today', u'=', u'death', u'air', u'pollution', u'lethal', u'injection', u'elections', u'matter', u"y'all", u'c', u'o', u't', u'u'],Hillary Clinton,NONE
[u'will', u'otherwise', u'guaranteed', u'gop', u'control', u'3', u'branches'],Hillary Clinton,AGAINST
[u'now', u'can', u'live', u'peace'],Hillary Clinton,NONE
[u'reading', u'say', u'wildly', u'impressed', u'hillary', u'clinton'],Hillary Clinton,FAVOR
[u'hillary', u'clinton', u'ambassador', u'isis'],Hillary Clinton,AGAINST
[u'bill', u'clinton', u'decided', u'taking', u'bin', u'laden', u'got', u'september'],Hillary Clinton,AGAINST
[u'watching', u'speech', u'right', u'now', u'missing', u'drop', u'tons', u'wisdom'],Hillary Clinton,FAVOR
[u'know', u'really', u'piss', u'?', u'. .', u'runs', u'lmao', u'!', u'wake', u'up', u'america', u'longer'],Hillary Clinton,AGAINST
[u'mama', u'hillary', u'making', u'case', u'just', u'exclusively', u'deal', u'complex', u'social', u'issues', u'mamaclinton'],Hillary Clinton,FAVOR
[u'chipotle', u'employees', u'complain', u'hillary', u'left', u'nothing', u'tip', u'jar', u'lucky', u'dip', u'help'],Hillary Clinton,AGAINST
[u'cool'],Hillary Clinton,NONE
[u'everything', u'hillary', u'touches', u'ends', u'scam', u'lie', u'cover-up', u'failure', u'william', u'just', u'want', u'president'],Hillary Clinton,AGAINST
[u'support', u'secret', u'?', u'?', u'?', u'no', u'hillary'],Hillary Clinton,AGAINST
[u'still', u'rather', u'aaron', u'hernandez', u'president', u'hillary'],Hillary Clinton,AGAINST
[u'sorry', u"hillary's", u'new', u'normal', u'folk', u'image', u'take', u'away', u'behgnazi', u'0', u'foreign', u'policy', u'successes', u'secretary', u'state'],Hillary Clinton,AGAINST
[u'c', u'c', u'thinks', u'can', u'run', u'antisocial', u'personal', u'attack', u'advertising', u'lol', u'!', u'stop', u'harper', u'feel', u'the', u'bern'],Hillary Clinton,NONE
[u'even', u'manage', u'wants'],Hillary Clinton,AGAINST
[u'pant', u'suite', u'hillary', u'hide', u'thighs', u'hillarys', u'donors', u'hillarys', u'big', u'announcement', u'benghazi', u'obama'],Hillary Clinton,AGAINST
[u'people', u'came', u'see', u'hear', u'hillary', u'press', u'obstructing', u'view'],Hillary Clinton,AGAINST
[u'agree', u'put', u'back', u'..', u'feeling', u'go', u'away', u'..', u'will', u'keep', u'coming', u'back', u'!'],Hillary Clinton,AGAINST
[u'mom', u'got', u'going', u'!', u'o', u't', u'u', u'chelseas', u'mom'],Hillary Clinton,FAVOR
[u'fashion', u'news', u'hillary', u'new', u'clothing', u'line', u'coming', u'called', u'flip', u'flops', u'r', u'us', u'benghazi'],Hillary Clinton,AGAINST
[u'love', u'wins', u'day', u'get', u'hillary', u'gear', u'!', u'yaaas', u'pride'],Hillary Clinton,FAVOR
[u'lmao', u'negro', u'democrat', u'decides', u'run', u'president', u'hillary', u'clinton', u'hillarys', u'big', u'announcement', u'hillarys', u'donors'],Hillary Clinton,AGAINST
[u'choose', u'takes', u'village', u'!'],Hillary Clinton,AGAINST
[u'democ', u'r', u't', u'slogans', u'work', u'?', u'can', u'vote', u'democrat', u'twice', u'!'],Hillary Clinton,AGAINST
[u'grow', u'economy', u'bottom', u'gets', u'trouble'],Hillary Clinton,AGAINST
[u'report', u'shows', u'u', u'state', u'department', u'locate', u'hillary', u"clinton's", u'private', u'emails', u'fast', u'hillary', u'!'],Hillary Clinton,AGAINST
[u'stand', u'bill', u'clinton', u'assaulting', u'teen', u'girls', u'?', u'ready', u'for', u'hillary', u'hillary', u'clinton', u'clinton'],Hillary Clinton,AGAINST
[u'simple', u"clinton's", u'corrupt'],Hillary Clinton,AGAINST
[u'thats', u'still', u'voting', u'rights'],Hillary Clinton,NONE
[u'cuz', u'know', u'feminist'],Hillary Clinton,NONE
[u'will', u'bill', u'clinton', u'winner', u'teen', u'girl', u'?', u'hillary', u'clinton', u'democrats', u'g', u'o'],Hillary Clinton,AGAINST
[u'bring', u'prosperity', u'line', u'workers', u'kindergarten', u'teachers', u'!', u'!', u'!'],Hillary Clinton,FAVOR
[u'vote', u'for', u'hillary', u'racist', u'leader', u'demands', u'equality', u'for', u'all'],Hillary Clinton,FAVOR
[u'even', u'manage', u'wants', u'wake', u'up', u'america', u'stop', u'hillary'],Hillary Clinton,AGAINST
[u'rt', u'follow', u'stand', u'hillary', u'!'],Hillary Clinton,AGAINST
[u'headed', u'chester', u'sc', u'big', u'hillary', u'canvass', u'!', u'join', u'wylie', u'park', u'3'],Hillary Clinton,FAVOR
[u'weekend', u'hillary', u'america', u'weekend', u'action', u'hope', u'participate', u'california'],Hillary Clinton,FAVOR
[u'afraid', u'answer', u'questions', u'press', u'want', u'potus'],Hillary Clinton,AGAINST
[u'bill', u'clinton', u'just', u'wants', u'first', u'dude', u'president', u'bang', u'one'],Hillary Clinton,NONE
[u'thank', u'much', u'rt', u'fav', u'!', u'!', u'!', u'wake', u'up', u'america', u'rubio', u'cruz'],Hillary Clinton,AGAINST
[u'rt', u'ready', u'one', u'day', u'girls', u'will', u'say', u'want', u'president', u'ready', u'for', u'hillary'],Hillary Clinton,AGAINST
[u'called', u'everyone', u'knew', u'raised', u'$', u'ex-boyfriends', u'sen', u'klobuchar'],Hillary Clinton,NONE
[u'never', u'vote', u'survival', u'country', u'love', u'wins'],Hillary Clinton,NONE
[u'just', u'hoping', u'resurrect', u'h8', u"hillary's", u'second', u'term'],Hillary Clinton,AGAINST
[u'free', u'market', u'capitalism', u"america's", u'best', u'friend', u'constant', u'pressure', u'innovate', u'use', u'resources', u'efficiently'],Hillary Clinton,AGAINST
[u'just', u'met', u'awesome', u'supporter', u'cx', u'bus', u'!', u'said', u'hillary', u'one', u'strong', u'woman', u'need', u'country', u'fellows', u'n', u'v'],Hillary Clinton,FAVOR
[u'totally', u'agree', u'hillary', u'incompetent', u'scandal', u'ridden', u'phony'],Hillary Clinton,AGAINST
[u'grasp', u'reality', u'?', u'need', u'characters', u'address', u'someone', u'naive', u'man'],Hillary Clinton,NONE
[u'official', u'every', u'single', u'g', u'o', u'member', u'now', u'candidate', u'o', u't', u'u', u'needs'],Hillary Clinton,AGAINST
[u'portuguese', u'support', u'campaign', u'!', u'best', u'luck', u'!', u'world', u'need', u'person', u'women', u'like', u'!', u'u'],Hillary Clinton,FAVOR
[u'since', u'n', u"ain't", u'funny', u'anymore', u'please', u'run', u'president', u'..', u'even', u'just', u'hilarious', u'debates'],Hillary Clinton,AGAINST
[u'like', u'tweeted', u'way', u'back', u'c', u'software', u'can', u'fixed', u'gop', u'strategic', u'mistake', u'repeal', u'fixed'],Hillary Clinton,AGAINST
[u'norman', u'hsu', u'illegally', u'donated', u'$', u'evidence', u'worked', u'china', u'white', u'house', u'sale'],Hillary Clinton,AGAINST
[u'wow', u'one', u'talk'],Hillary Clinton,AGAINST
[u'done', u'got', u'rid', u'!', u'!', u'!', u'no', u'hillary'],Hillary Clinton,AGAINST
[u'dreamt', u'hilary', u'clinton', u'last', u'night', u'mean', u'plans', u'control', u'us', u'take', u'world', u'coming', u'true', u'?'],Hillary Clinton,AGAINST
[u'take', u'saudi', u'money', u'?', u'saudi', u'cables', u'saudi', u'cables'],Hillary Clinton,AGAINST
[u'fox', u'news', u'predicting', u'3', u'way', u'marriage-gee', u'mormons', u'!'],Hillary Clinton,NONE
[u'exactly', u'want', u'see', u'happen', u'america'],Hillary Clinton,AGAINST
[u'w', u'g', u'n', u't', u'v', u'now', u'mentions', u'romney', u'?', u'hillary', u'care', u'=', u'romney', u'care', u'=', u'obamacare', u'now', u'public', u'option'],Hillary Clinton,NONE
[u'super', u'touch', u'stupid', u'please', u'go', u'away', u'n', u'y', u'c', u'pride', u'n', u'y', u'c'],Hillary Clinton,AGAINST
[u"hillary's", u'campaign', u'raised', u'$', u'million', u'%', u'donations', u'$', u'less', u'record', u'beating', u"obama's", u'record'],Hillary Clinton,AGAINST
[u'qualified', u'b', u'c', u'eats', u'$', u'snacks', u'b', u'c', u'd', u'corruption', u'bridgegate', u'big', u'fat', u'bully', u'!'],Hillary Clinton,AGAINST
[u'obama', u'administration', u'lies', u'..', u'knew', u'hillary', u'emails', u'private', u'..', u'transparency', u'?', u'?', u'?'],Hillary Clinton,AGAINST
[u'thankful', u'volunteers', u'joined', u'us', u'bliss', u'studio', u'fairfield', u'tonight', u'!', u'rockstars'],Hillary Clinton,NONE
[u'run', u'office', u'will', u'original', u'logo', u'm', u'hill', u'no', u'unite', u'blue'],Hillary Clinton,AGAINST
[u'hahahaha', u'combed', u'emails', u'!', u'!', u'!', u'bunch', u'scumbags', u'!', u'!', u'!', u'no', u'hillary'],Hillary Clinton,AGAINST
[u'feel', u'bill', u"clinton's", u'latest', u'assault', u'teen', u'girl', u'?', u'hillary', u'clinton', u'hillary__', u'n', u'o'],Hillary Clinton,AGAINST
[u'kind', u'gov', u'liberals', u'promise', u'can', u'achieved', u'sustained', u'conservative', u'government', u'heat', u'wave'],Hillary Clinton,AGAINST
[u'though', u'people', u'saying', u'just', u'going', u'vote', u'ridiculous'],Hillary Clinton,NONE
[u"abedin's", u'penumbra', u'muslim', u'brotherhood', u'connection', u'incontrovertible', u'huma', u'abedin'],Hillary Clinton,AGAINST
[u'scotus', u'dealt', u'blow', u'hillary', u'clintons', u'last', u'campaign', u'promise', u'...', u'running', u'now', u'?', u'corruption', u'lies', u'deceit'],Hillary Clinton,AGAINST
[u'rainbow', u'logo', u'?', u'u', u'know', u'4', u'%', u'us', u'gay', u'?', u'census', u'why', u'im', u'not', u'voting', u'for', u'hillary'],Hillary Clinton,AGAINST
[u'emails', u'said', u'couple', u'facebooks', u':)', u'total', u'incompetence', u'red', u'nation', u'rising'],Hillary Clinton,AGAINST
[u'rt', u'huge', u'cheer', u'universal', u'child', u'care', u'early', u'childhood', u'education'],Hillary Clinton,NONE
[u'low', u'key', u'interesting', u'female', u'president'],Hillary Clinton,FAVOR
[u'hey', u'texas', u'state', u'bobcats', u'hope', u"y'all", u'ready', u'marco', u'rubio', u'texas', u'state', u'university', u'new', u'american', u'century', u'texas', u't', u'c', u'o', u't'],Hillary Clinton,NONE
[u'lawyer', u'know', u'clintons', u'violated', u'ethics', u'rules'],Hillary Clinton,AGAINST
[u'kool-aid', u'drinking', u'leftanistas', u'continue', u'close', u'ranks', u'support', u'madame', u'secretary', u'wtf', u'?', u'hillary', u'fraud', u'full', u'lies'],Hillary Clinton,AGAINST
[u'help', u'election'],Hillary Clinton,FAVOR
[u"hillary's", u'new', u'campaign', u'slogan', u'hillary', u'nothing', u'hide', u'truth', u'!', u'wake', u'up', u'america'],Hillary Clinton,AGAINST
[u'even', u'manage', u'wants', u'wake', u'up', u'america', u'stop', u'hillary'],Hillary Clinton,AGAINST
[u'biggest', u'dumps', u'bad', u'info', u'b4', u'holiday', u'weekend', u'comes', u'wh', u'state', u'dept', u'today', u'?', u'hillary', u'emails', u'liar', u'liar'],Hillary Clinton,AGAINST
[u'thanks', u'follow', u'!', u'the', u'h', u'r', u'c', u'super', u'vols'],Hillary Clinton,NONE
[u'course', u'silent', u'insures', u'2', u'stand', u'4', u'anything', u'less', u'chance', u'offending', u'voters'],Hillary Clinton,AGAINST
[u'insurgent', u'will', u'happen', u'hillary', u'becomes', u'dictator', u'chief'],Hillary Clinton,AGAINST
[u'remember', u'millions', u"gwbush's", u'emails', u'went', u'missing', u'deleted', u're', u'iraq', u'war', u'nobody', u'hearing', u'?', u'yawn', u'!'],Hillary Clinton,NONE
[u'bur', u'hlllary', u'just', u'raised', u'million', u'!'],Hillary Clinton,AGAINST
[u'made', u'careless', u'mistake', u'deliberately', u'broke', u'many', u'laws', u'still', u'lies'],Hillary Clinton,AGAINST
[u'river', u'woods', u'hill', u'go', u'!', u'yass', u'hillary', u'clinton', u'hillary'],Hillary Clinton,AGAINST
[u'many', u'men', u'getting', u'dicks', u'sucked', u'daily', u'congress', u'etc', u'one', u'gives', u'shit', u'...'],Hillary Clinton,NONE
[u'sen', u'kaine', u'd-va', u'c', u'o', u't', u'u', u'marriage', u'great', u'victory', u'!'],Hillary Clinton,NONE
[u'hillary', u'best', u'choice', u'truly', u'want', u'continue', u'progressive', u'nation', u'ohio'],Hillary Clinton,FAVOR
[u'saw', u'bit', u'speech', u'proud', u'hear', u'plans', u'policy', u'improvements', u'justice', u'system', u'thanks', u'!'],Hillary Clinton,FAVOR
[u'putin', u'last', u'thing', u'us', u'needs', u'right', u'now', u'another', u'clinton', u'bush', u'white', u'house', u'dynasty', u'now', u'?', u'jeb'],Hillary Clinton,AGAINST
[u'sir', u'sory', u'mae', u'bi', u'bharat', u'mool', u'ka', u'hu', u'par', u'hart', u'democraet'],Hillary Clinton,NONE
[u'stump', u'speech', u'stump', u'park', u'attendance', u'mandatory'],Hillary Clinton,NONE
[u'take', u'faith', u'almost', u'every', u'political', u'entity', u'around', u'whether', u'dissident', u'serves', u'good', u'purpose', u'dempublicans'],Hillary Clinton,AGAINST
[u'love_peace', u'peaceful', u'coexistence', u'violence'],Hillary Clinton,NONE
[u'hillary', u'clinton', u'might', u'end', u'vote', u'tackling', u'many', u'issues', u'america', u'needs', u'face'],Hillary Clinton,FAVOR
[u'well', u'strung', u'happed', u'next', u'time', u'hillary-loving', u'ass', u'douches', u'encounter', u'trees', u'red', u'eye'],Hillary Clinton,AGAINST
[u'least', u'lose', u'embassy', u'cover', u'murder', u'burn', u'govt', u'emails'],Hillary Clinton,AGAINST
[u'far', u'just', u'fucking', u'far', u'baltimore', u'uprising', u'obama'],Hillary Clinton,NONE
[u'must', u'hard', u'work', u'burying', u'anti-lgbt', u'rights', u'record', u'love', u'wins', u'feel', u'the', u'bern'],Hillary Clinton,AGAINST
[u'animal', u'!', u'!', u'also', u'sellout', u'!', u'!', u'!', u'ppl', u'vote', u'sellouts', u'!', u'!', u'no', u'hillary'],Hillary Clinton,AGAINST
[u'days', u'can', u'register', u'vote', u'!', u'!', u'1', u'year', u'days', u'election', u'day', u'rock', u'the', u'vote'],Hillary Clinton,FAVOR
[u'woman', u'like', u'teflon', u'?', u'committed', u'enuf', u'egregious', u'crimes', u'b', u'superglued', u'2the', u'dang', u'wall', u'!'],Hillary Clinton,AGAINST
[u'apple', u'walmart', u'=', u'made', u'china', u'country', u'continue', u'sell', u'us', u'china', u'every', u'way', u'possible', u'?', u'apple', u'music'],Hillary Clinton,NONE
[u'rt', u'2nd', u'tweet', u'potus', u'candidates', u'read', u'article-esp', u'jeb', u'bush', u'make', u'gun', u'violence', u'worse', u'gun', u'sen', u'...'],Hillary Clinton,AGAINST
[u'get', u'state', u'bum', u'!', u'unite', u'blue'],Hillary Clinton,NONE
[u'just', u'ordered', u'chillary', u'clinton', u'koozies', u'gotta', u'support', u'team'],Hillary Clinton,AGAINST
[u'leave', u'much', u'talk', u'?'],Hillary Clinton,NONE
[u'enthusiasm', u'gap', u'mr', u'lawrence', u'!', u'hillarymen'],Hillary Clinton,AGAINST
[u'proven', u'dishonesty', u'flip', u'flopping', u'issue', u'people', u'know', u'opposed'],Hillary Clinton,AGAINST
[u'think', u'main', u'problem', u'foot', u'mouth', u'first', u'place'],Hillary Clinton,NONE
[u'literally', u'greatest', u'video', u'ever', u'seen'],Hillary Clinton,FAVOR
[u'anything', u'clintons', u'fraudulent', u'?'],Hillary Clinton,AGAINST
[u'best', u'side', u'offer', u'nothing', u'worry', u'slick'],Hillary Clinton,NONE
[u'that', u'champion', u'got', u'kicked', u'watergate', u'team', u'due', u'misconduct'],Hillary Clinton,NONE
[u'why', u'im', u'not', u'voting', u'for', u'hillary', u'calls', u'education', u'non-family', u'enterprise', u'im', u'committed2', u'defeat', u'hillary', u'?'],Hillary Clinton,AGAINST
[u'ask', u'bobby', u'blame', u'obscure', u'film', u'maker', u'death', u'u', u'ambassador', u'benghazi', u'like'],Hillary Clinton,AGAINST
[u'thank', u'kind', u'rts', u'favs', u'!', u'!', u'!', u'wake', u'up', u'america', u'cuba'],Hillary Clinton,AGAINST
[u'spoke', u'today', u'nyc', u'wow', u'!', u'smart', u'impressive', u'!', u'!', u'!'],Hillary Clinton,FAVOR
[u'hillarys', u'accomplishments', u'total', u'clusterfuck', u'anything', u'ready', u'for', u'hillary', u'unite', u'blue', u'top', u'prog', u't', u'o', u't', u'lib', u'crib'],Hillary Clinton,AGAINST
[u'support', u'encourage', u'hillary', u'clinton', u'president', u'united', u'states', u'world', u'success', u'women', u'world'],Hillary Clinton,FAVOR
[u'rt', u'. .', u'name', u'change', u';', u'longer', u'hrc', u'now', u'hillary', u'uranium', u'benghazi', u'clinton', u'take', u'note'],Hillary Clinton,AGAINST
[u"hillary's", u'campaign', u'events', u'scripted', u'dog', u'pony', u'shows', u'designed', u'shelter', u'vetting', u'b4', u'coronation'],Hillary Clinton,AGAINST
[u'expect', u'change', u'continue', u'vote', u'people', u'take', u'chance', u'4yrs', u'long', u'bernie'],Hillary Clinton,AGAINST
[u'care', u'fiorina', u'seems', u'taking', u'gut', u'punches', u'm', u'm'],Hillary Clinton,NONE
[u'kidding', u'...', u'leave', u'focus', u'issues', u'...', u'next', u'prez'],Hillary Clinton,FAVOR
[u'tolerance', u'best', u'!', u'say'],Hillary Clinton,NONE
[u'things', u'you', u'dont', u'say', u'as', u'politician', u'feel', u'ways', u'tired', u'go', u'back', u'line', u'difference', u'make', u'?'],Hillary Clinton,NONE
[u'white', u'middle-aged', u'men', u'pretty', u'good', u'job', u'leading', u'country', u'yrs', u'racist', u'?', u'sexist', u'?', u'realist'],Hillary Clinton,AGAINST
[u"hillary's", u'still', u'weak', u'among', u'grassroots', u'shown', u'strong', u'bernie', u'sanders', u'got', u'fast', u'little'],Hillary Clinton,AGAINST
[u'rt', u'republicans', u'everywhere', u'looking', u'someone', u'lead', u'leader', u'liar'],Hillary Clinton,AGAINST
[u'champion', u'data', u'removal'],Hillary Clinton,AGAINST
[u'especially', u'paid', u'union', u'lackies', u'idea', u'propaganda', u'machine', u'spinning', u'overtime'],Hillary Clinton,AGAINST
[u'agree', u'previous', u'stance', u';', u'sure', u'still', u'believes', u'said'],Hillary Clinton,AGAINST
[u'ask', u'bobby', u'think', u'hillary', u'clinton', u'turned', u'emails', u'private', u'server', u'destroyed', u'!'],Hillary Clinton,AGAINST
[u'rt', u'1', u'select', u'people', u'fired', u'4', u'2', u'unethical', u'2', u'investigate', u'watergate'],Hillary Clinton,AGAINST
[u'notice', u'condemn', u'lawless', u'actions', u'rioters'],Hillary Clinton,AGAINST
[u'think', u'take', u'now', u'..', u'scary', u'say'],Hillary Clinton,NONE
[u'even', u'manage', u'wants', u'wake', u'up', u'america', u'stop', u'hillary'],Hillary Clinton,AGAINST
[u'lied', u'cost', u'gala', u'fined', u'jail', u'unfit', u'office'],Hillary Clinton,AGAINST
[u'perfect', u'definition', u'jibberish', u'unite', u'blue'],Hillary Clinton,NONE
[u'cant', u'fix', u'stupid', u'might', u'able', u'vote', u'either'],Hillary Clinton,NONE
[u'hillary', u'clinton', u'keeps', u'sending', u'emails', u'try', u'unsubscribe', u'get', u'error', u'message', u'cancer'],Hillary Clinton,AGAINST
[u'voting', u'democrat', u'primary', u'year', u'...', u'support'],Hillary Clinton,AGAINST
[u'y', u'take', u'donations', u'white', u'supremacy', u'group', u'shaking', u'hands', u'black', u'leaders', u'?', u'black', u'lives', u'matter'],Hillary Clinton,NONE
