[u'love', u'!', u'one', u'biggest', u'donors', u'saudi', u'arabia', u'support', u"women's", u'rights', u'completely', u'!', u'go', u'team'],Hillary Clinton,AGAINST
[u'night', u'sleep', u'tight', u'let', u'hillary', u'bite', u'says', u'nightmares', u'say'],Hillary Clinton,AGAINST
[u'ding', u'dong', u'___', u'___', u'__', u'___'],Hillary Clinton,NONE
[u'leader', u'free', u'world', u'global', u'navigating', u'interacting', u'international', u'community', u'beyond', u'big', u'crowds', u'learned', u'lesson'],Hillary Clinton,AGAINST
[u'ambient', u'temperature', u'hell', u'today', u'?', u'use', u'guide', u'!'],Hillary Clinton,AGAINST
[u'anyone', u'can', u'believe', u'single', u'word', u'comes', u"woman's", u'mouth', u'beyond', u'...'],Hillary Clinton,AGAINST
[u'also', u'finally', u'moved', u'today', u'!', u'will', u'much', u'easier', u'get', u'around', u'going', u'forward', u'!'],Hillary Clinton,NONE
[u'queen', u'city', u'currently', u'infested', u'w', u'out-of-state', u'plate', u'priuses', u'driven', u'millennials', u'w', u'hillary', u'bumper', u'stickers', u'm', u'h', u't'],Hillary Clinton,AGAINST
[u'clinton', u'foundation', u'keep', u'accepting', u'bribes', u'foreign', u'governments', u'why', u'im', u'not', u'voting', u'for', u'hillary'],Hillary Clinton,AGAINST
[u'?', u'tht', u'will', u'never', u'erase', u'support', u'doma', u'silence', u'g', u'b', u't', u'g', u'b', u't', u'q', u'rights', u'politically', u'aventageous'],Hillary Clinton,AGAINST
[u'exciting', u'hear', u'fellows', u'across', u'country', u"tonight's", u'call', u'special', u'shout-out', u'fellows'],Hillary Clinton,NONE
[u'much', u'like', u'good', u'people', u'forgot', u'couple', u'weeks', u'ago'],Hillary Clinton,NONE
[u'gay', u'rights', u'human', u'rights', u'human', u'rights', u'gay', u'rights', u'hillary', u'for', u'america'],Hillary Clinton,FAVOR
[u'ever', u'meet', u'hillary', u'clinton', u'will', u'died', u'come', u'back', u'life', u'b', u'c', u'will', u'happy'],Hillary Clinton,FAVOR
[u'hrc', u'popular', u'?', u'deceptive', u'socialist', u'accomplished', u'nothing', u'wife', u'impeached', u'president', u'enabled', u'ubl'],Hillary Clinton,AGAINST
[u'opening', u'offices', u'iowa', u'week', u'playing', u'around', u'!'],Hillary Clinton,AGAINST
[u'think', u'going', u'vote', u'monica', u"lewinsky's", u'ex', u'boyfriends', u'wife'],Hillary Clinton,FAVOR
[u'thanks', u'amazing', u'noms', u'canvassing', u'f', u't', u'n'],Hillary Clinton,FAVOR
[u'even', u'manage', u'wants', u'wake', u'up', u'america', u'stop', u'hillary'],Hillary Clinton,AGAINST
[u'thank', u'much', u'follow', u'fav', u'jeane', u'!', u'!', u'!', u'gods', u'best', u'!', u'wake', u'up', u'america'],Hillary Clinton,NONE
[u'although', u'certainly', u'disagreements', u'reading', u'much', u'rather'],Hillary Clinton,AGAINST
[u'really', u'need', u'new', u'shirt', u'come', u'meeting', u'people', u'brewery', u'night', u'bernie', u'meetup'],Hillary Clinton,FAVOR
[u'clinton', u'foundation', u'collected', u'$', u'm', u'spent', u'$', u'9m', u'direct', u'aid', u'raised', u'$', u'm', u'spent', u'$', u'm', u'direct', u'aid', u'!'],Hillary Clinton,AGAINST
[u'bernie', u'hillary', u'?', u'prefer', u'bernie', u'hillary', u'fine', u'either', u'way', u'dems', u'gotta', u'stand', u'together', u'feelthe', u'bern'],Hillary Clinton,FAVOR
[u'intelligent', u'choice', u'usa', u'hillary', u'clinton', u'...', u'can', u'afford', u'stay', u'home', u'...', u'must', u'vote', u'vote', u'unite', u'blue'],Hillary Clinton,FAVOR
[u'thank', u'sir', u'honor', u'hear', u'usa', u'life', u'spread', u'remember', u'benghazi'],Hillary Clinton,NONE
[u'hillary', u'can', u'win', u'hoping', u'dems', u'offer', u'real', u'candidate', u'like', u'warren', u'warren'],Hillary Clinton,AGAINST
[u'operating', u'shredder', u'now', u'way', u'adept', u'using', u'!', u'wake', u'up', u'america', u't', u'c', u'o', u't', u'oh', u'hill', u'n', u'o', u'!'],Hillary Clinton,AGAINST
[u'madam', u'president', u'clinton', u';', u'gays', u'vote'],Hillary Clinton,FAVOR
[u'bet', u'leslie', u'knope', u'happy'],Hillary Clinton,FAVOR
[u'everything', u'abt', u'bogus', u'issues', u'history', u'iowa', u'trip', u'twitter', u'followers', u'campaigning'],Hillary Clinton,AGAINST
[u'marriage', u'equality', u'constitutional', u'right', u'!', u'woot', u'h', u'r', u'c'],Hillary Clinton,FAVOR
[u'whole', u'supporting'],Hillary Clinton,FAVOR
[u'sheeple', u'will', u'still', u'vote'],Hillary Clinton,AGAINST
[u'even', u'manage', u'wants', u'wake', u'up', u'america', u'stop', u'hillary'],Hillary Clinton,AGAINST
[u'realize', u'pay', u'to', u'play', u'diplomacy', u'big', u'hit', u'!'],Hillary Clinton,AGAINST
[u'kind', u'scares', u'still', u'thousands', u'emails', u'released', u"hillary's", u'private', u'emails'],Hillary Clinton,AGAINST
[u'need', u'meninist', u'running', u'president', u'...', u'need', u'say', u'?'],Hillary Clinton,AGAINST
[u'looking', u'forward', u'c', u'u', u'b', u'expanding', u'major', u'exports', u'pick', u'trucks', u'converted', u'rafts', u'!', u'!', u'exciting', u'!'],Hillary Clinton,AGAINST
[u'results', u'matter', u'u', u'may', u'feel', u'less', u'safe', u'ur', u'mental', u'health', u'issues', u'9', u"obama's", u'watch'],Hillary Clinton,AGAINST
[u'g', u'b', u't', u'pride', u'condoms', u'bill', u'clinton', u'used', u'assaulted', u'monica', u'lewinsky', u'?', u'hillary', u'clinton'],Hillary Clinton,AGAINST
[u'even', u'manage', u'wants', u'stop', u'hillary'],Hillary Clinton,AGAINST
[u'ya', u'go', u'teddy', u'boy', u'..', u'world', u'getting', u'hotter', u'!', u'!', u'called', u'global', u'warming', u'!', u'!', u'putz', u'!', u'!'],Hillary Clinton,NONE
[u'body-cam', u'every', u'cop', u'private', u'servers', u'cabinet', u'secretaries'],Hillary Clinton,NONE
[u'vote', u'definitely', u'hillary', u'want', u"bush's", u'dumb', u'ass', u'want', u'trump', u'either', u'hillary', u'clinton'],Hillary Clinton,FAVOR
[u'pantsuits', u'camouflage', u'outfits', u'carefully', u'tailored', u'minimize', u'silhouette', u'think', u'stealthsuits.very', u'high', u'tech'],Hillary Clinton,AGAINST
[u'name', u'rebecca', u'grandmother', u'immigrated', u'sunnybrook', u'farm'],Hillary Clinton,NONE
[u'never', u'dream', u'intelligent'],Hillary Clinton,FAVOR
[u'wondering', u'next', u'idiotic', u'gop', u'smear', u'will', u'coming', u'sure', u'just', u'know', u'details', u'yet'],Hillary Clinton,FAVOR
[u'contrary', u'happy', u'will', u'win', u'enjoy', u'seeing', u'liberal', u'cities', u'burn', u'go'],Hillary Clinton,FAVOR
[u'owner', u'univisin', u'donated', u'much', u'$', u'million', u'clinton', u'foundation', u'wife', u'sits', u'board', u'univision', u'trump'],Hillary Clinton,AGAINST
[u'friday', u'officially', u'political', u'incorrectness', u'day', u'!', u'day', u'say', u'whatever', u'want', u'offend', u'everyone', u'!', u'yay', u'!', u'c'],Hillary Clinton,NONE
[u'gwen', u'good', u'leader', u'training', u'new', u'volunteer', u'rock', u'hill', u'!', u'fellows', u'c', u'hillary', u'for', u'c'],Hillary Clinton,FAVOR
[u'guarantee', u'hillary', u'care', u'less', u'black', u'rights', u'obama', u'blacks', u'predicament', u'still'],Hillary Clinton,AGAINST
[u'used', u'calling', u'approval', u'running', u'story', u'like', u'hillary', u'hillary', u'emails'],Hillary Clinton,AGAINST
[u'serious', u'trump', u'runs', u'get', u'trump', u'tattoo', u'?', u'calling', u'donald', u'!', u'!'],Hillary Clinton,NONE
[u'come', u'visit', u'jefferson', u'county', u'fair', u'!', u'representative', u'curt', u'hanson', u'will', u'tell', u'joke', u'tell', u'story', u'vote'],Hillary Clinton,NONE
[u'dukes', u'hazzard', u'tv', u'years', u'yet', u'offended', u'told'],Hillary Clinton,AGAINST
[u'bernie', u'sanders', u'record', u'crowds', u'madison', u'wis', u'mention', u'guys', u'talked', u'trump', u'trump'],Hillary Clinton,NONE
